{
  "schema_version": "1.0.0",
  "bundle_id": "NBTVVQ0PYAD4F7KJ8Y2T3Q3WVW",
  "task_intent": "review PR #2900 in playsweeps-web",
  "task_type": "review",
  "created_at": "2026-05-22T10:00:00Z",
  "created_by": "nhoxtvt@gmail.com",
  "items": [
    {
      "uri": "github://playsweeps-web/pull/2900",
      "name": "PR #2900",
      "content": "Diff: changes to auth saga + KYC handler",
      "source": "github",
      "source_ref": "playsweeps-web#2900",
      "fetched_at": "2026-05-22T10:00:01Z",
      "fetched_by": "nhoxtvt@gmail.com",
      "approved": true,
      "relevance_score": 1.0,
      "relevance_reason": "exact-pr-reference",
      "evidence_quality": "verified",
      "evidence_quality_reason": "primary-mcp-call",
      "mcp_used": "github_get_pull_request",
      "query_issued": "{\"owner\":\"hoainho\",\"repo\":\"playsweeps-web\",\"pull_number\":2900}",
      "extensions": {}
    },
    {
      "uri": "jira://WIN-7518",
      "name": "WIN-7518 — Linked from PR description",
      "content": "MFA cooldown not resetting...",
      "source": "jira",
      "source_ref": "WIN-7518",
      "fetched_at": "2026-05-22T10:00:03Z",
      "fetched_by": "nhoxtvt@gmail.com",
      "approved": true,
      "relevance_score": 0.85,
      "relevance_reason": "linked-from-pr-body",
      "conflict_marker": true,
      "evidence_quality": "verified",
      "evidence_quality_reason": "primary-mcp-call",
      "mcp_used": "jira_jira_issues",
      "query_issued": "{\"action\":\"get\",\"issueKey\":\"WIN-7518\"}",
      "extensions": {"conflict_with": ["atom://playsweeps-web/2026-05-15-auth-saga-decision"]}
    },
    {
      "uri": "atom://playsweeps-web/2026-05-15-auth-saga-decision",
      "name": "Past decision: keep auth saga ordering",
      "content": "We decided NOT to change auth saga ordering...",
      "source": "atoms",
      "source_ref": "playsweeps-web/2026-05-15-auth-saga-decision",
      "fetched_at": "2026-05-22T10:00:02Z",
      "fetched_by": "nhoxtvt@gmail.com",
      "approved": true,
      "relevance_score": 0.78,
      "relevance_reason": "keyword-overlap-auth-saga",
      "conflict_marker": true,
      "evidence_quality": "verified",
      "evidence_quality_reason": "primary-mcp-call",
      "mcp_used": "omo-session-distiller_recall",
      "query_issued": "{\"query\":\"auth saga ordering\",\"repo\":\"playsweeps-web\",\"limit\":3}",
      "extensions": {"conflict_with": ["jira://WIN-7518"]}
    }
  ],
  "gaps": [],
  "audit_log_ref": ".opencode/audit/2026-05-22/NBTVVQ0PYAD4F7KJ8Y2T3Q3WVW.ndjson",
  "status": "approved",
  "hash": "c8d4f2a9b6c3e8d2f4a9b6c3e8d2f4a9b6c3e8d2f4a9b6c3e8d2f4a9b6c3e8d2",
  "cost_tokens": 6800,
  "cost_budget": 12000,
  "scoring_strategy": "content-hash-v1"
}
